274,[],False,redeemer4,,[],,text,t2_5qlit521,False,False,[],False,False,1589504472,youtube.com,https://www.reddit.com/r/nba/comments/gjzbl0/cole_anthony_offensive_strengths_nba_draft/,{},gjzbl0,False,False,False,False,False,False,False,,[],dark,text,False,"{'oembed': {'author_name': 'NBA DRAFT JUNKIES', 'author_url': 'https://www.youtube.com/user/blazers500', 'height': 338, 'html': '&lt;iframe width=""600"" height=""338"" src=""https://www.youtube.com/embed/fNgEhfpa5fY?feature=oembed&amp;enablejsapi=1"" frameborder=""0"" allow=""accelerometer; autoplay; encrypted-media; gyroscope; picture-in-picture"" allowfullscreen&gt;&lt;/iframe&gt;', 'provider_name': 'YouTube', 'provider_url': 'https://www.youtube.com/', 'thumbnail_height': 360, 'thumbnail_url': 'https://i.ytimg.com/vi/fNgEhfpa5fY/hqdefault.jpg', 'thumbnail_width': 480, 'title': 'Cole Anthony | Offensive Strengths | NBA Draft Junkies 2020 Draft Prospects', 'type': 'video', 'version': '1.0', 'width': 600}, 'type': 'youtube.com'}","{'content': '&lt;iframe width=""600"" height=""338"" src=""https://www.youtube.com/embed/fNgEhfpa5fY?feature=oembed&amp;enablejsapi=1"" frameborder=""0"" allow=""accelerometer; autoplay; encrypted-media; gyroscope; picture-in-picture"" allowfullscreen&gt;&lt;/iframe&gt;', 'height': 338, 'scrolling': False, 'width': 600}",False,True,0,0,False,all_ads,/r/nba/comments/gjzbl0/cole_anthony_offensive_strengths_nba_draft/,False,rich:video,"{'enabled': False, 'images': [{'id': '2lL4DkVlW_jmhkfjNSqDXDhdZ09YoauapzBqoXHkMFI', 'resolutions': [{'height': 81, 'url': 'https://external-preview.redd.it/8Zmzak_jLmvNh8WjuuYK0DJjCSPp9Z8X22R4uxkYQdI.jpg?width=108&amp;crop=smart&amp;auto=webp&amp;s=7e21b454c72ac56cf3060ca218444a2053cf0619', 'width': 108}, {'height': 162, 'url': 'https://external-preview.redd.it/8Zmzak_jLmvNh8WjuuYK0DJjCSPp9Z8X22R4uxkYQdI.jpg?width=216&amp;crop=smart&amp;auto=webp&amp;s=24421f687e9bfc6711ed086f1b36dc288b2439f7', 'width': 216}, {'height': 240, 'url': 'https://external-preview.redd.it/8Zmzak_jLmvNh8WjuuYK0DJjCSPp9Z8X22R4uxkYQdI.jpg?width=320&amp;crop=smart&amp;auto=webp&amp;s=4aba70b254e3e29c170b6d5455754885d38e6912', 'width': 320}], 'source': {'height': 360, 'url': 'https://external-preview.redd.it/8Zmzak_jLmvNh8WjuuYK0DJjCSPp9Z8X22R4uxkYQdI.jpg?auto=webp&amp;s=dcf4d2f4a810590ff32299efcb6d0a480964b049', 'width': 480}, 'variants': {}}]}",6,1589504687,1,"{'oembed': {'author_name': 'NBA DRAFT JUNKIES', 'author_url': 'https://www.youtube.com/user/blazers500', 'height': 338, 'html': '&lt;iframe width=""600"" height=""338"" src=""https://www.youtube.com/embed/fNgEhfpa5fY?feature=oembed&amp;enablejsapi=1"" frameborder=""0"" allow=""accelerometer; autoplay; encrypted-media; gyroscope; picture-in-picture"" allowfullscreen&gt;&lt;/iframe&gt;', 'provider_name': 'YouTube', 'provider_url': 'https://www.youtube.com/', 'thumbnail_height': 360, 'thumbnail_url': 'https://i.ytimg.com/vi/fNgEhfpa5fY/hqdefault.jpg', 'thumbnail_width': 480, 'title': 'Cole Anthony | Offensive Strengths | NBA Draft Junkies 2020 Draft Prospects', 'type': 'video', 'version': '1.0', 'width': 600}, 'type': 'youtube.com'}","{'content': '&lt;iframe width=""600"" height=""338"" src=""https://www.youtube.com/embed/fNgEhfpa5fY?feature=oembed&amp;enablejsapi=1"" frameborder=""0"" allow=""accelerometer; autoplay; encrypted-media; gyroscope; picture-in-picture"" allowfullscreen&gt;&lt;/iframe&gt;', 'height': 338, 'media_domain_url': 'https://www.redditmedia.com/mediaembed/gjzbl0', 'scrolling': False, 'width': 600}",,True,False,False,nba,t5_2qo4s,3257748,public,image,105.0,140.0,Cole Anthony | Offensive Strengths | NBA Draft Junkies 2020 Draft Prospects,0,[],1.0,https://www.youtube.com/watch?v=fNgEhfpa5fY,all_ads,6,,,,,,,moderator,,,,,,,,,
275,[],False,griffin_booth,,[],,text,t2_170098,False,False,[],False,False,1589504457,self.nba,https://www.reddit.com/r/nba/comments/gjzbej/hypothetically_if_you_were_to_start_a_new_nba/,{},gjzbej,True,False,False,False,True,True,False,,[],dark,text,False,,,False,True,49,0,False,all_ads,/r/nba/comments/gjzbej/hypothetically_if_you_were_to_start_a_new_nba/,False,,,6,1589504671,1,,,Me and some buddies have been debating this question I thought of earlier. I said I would either take Jaylen Brown (Celtics protect Kemba and Tatum) or Lonzo (Pels protect Zion and Ingram).,True,False,False,nba,t5_2qo4s,3257747,public,self,,,"Hypothetically, if you were to start a new NBA franchise tomorrow and every team can only protect their 2 best players. Who would be the first guy you take and why?",0,[],1.0,https://www.reddit.com/r/nba/comments/gjzbej/hypothetically_if_you_were_to_start_a_new_nba/,all_ads,6,,,,,,,,,,,,,,,,
276,[],False,CousinEddieMoneyshot,,[],,text,t2_cdhbf,False,False,[],False,False,1589504158,self.nba,https://www.reddit.com/r/nba/comments/gjz8hn/how_many_teams_at_the_bottom_of_the_standings/,{},gjz8hn,True,False,False,False,True,True,False,,[],dark,text,False,,,False,True,11,0,False,all_ads,/r/nba/comments/gjz8hn/how_many_teams_at_the_bottom_of_the_standings/,False,,,6,1589504412,1,,,"For this thought experiment, let’s toss out the Warriors. Starting with Cleveland and moving up, you can pull any player from a low ranked team’s roster and add them to this imaginary contender. You can skip over a team entirely without adding any players, but that team will still count towards the total number. So, what’s the fewest number of “bad” teams you would need to build a 2020 Finals champ?

I think I could do it in 12 (No 29 Cleveland-No 18 New Orleans). Here’s my roster:
Russell, KAT, Capela, Griffin, Rose, Randle, Beal, Ayton, Booker, Aldridge, Hield, Fox, Ingram, Williamson",True,False,False,nba,t5_2qo4s,3257723,public,self,,,How many teams at the bottom of the standings would you need to combine in order to put together a roster that could challenge the Lakers or Bucks (top 2 teams currently)?,0,[],1.0,https://www.reddit.com/r/nba/comments/gjz8hn/how_many_teams_at_the_bottom_of_the_standings/,all_ads,6,,,,,,,,,,,,,,,,
277,[],False,iama_scientist123,,[],,text,t2_3djv3q5q,False,False,[],False,False,1589504089,podcasts.apple.com,https://www.reddit.com/r/nba/comments/gjz7uf/game_of_zones_creators_adam_and_craig_malamut/,{},gjz7uf,True,False,False,False,True,False,False,,[],dark,text,False,,,False,True,17,0,False,all_ads,/r/nba/comments/gjz7uf/game_of_zones_creators_adam_and_craig_malamut/,False,link,"{'enabled': False, 'images': [{'id': 'aPtCWOXAYeTncKC1s--eFLywUkqSZx0OihLqC_jd-JE', 'resolutions': [{'height': 56, 'url': 'https://external-preview.redd.it/3E9te2nqQifjA98pl_u9NW33LPElWihwLwcVT3gLAak.jpg?width=108&amp;crop=smart&amp;auto=webp&amp;s=0a0e7149a6d601a74e5a419b728352c2f9edac04', 'width': 108}, {'height': 113, 'url': 'https://external-preview.redd.it/3E9te2nqQifjA98pl_u9NW33LPElWihwLwcVT3gLAak.jpg?width=216&amp;crop=smart&amp;auto=webp&amp;s=30689b9e19224c9367c5cca776f0dc5132e29a73', 'width': 216}, {'height': 168, 'url': 'https://external-preview.redd.it/3E9te2nqQifjA98pl_u9NW33LPElWihwLwcVT3gLAak.jpg?width=320&amp;crop=smart&amp;auto=webp&amp;s=d138ea1fc715f89936d66a4dc7278a6a9aca1a56', 'width': 320}, {'height': 336, 'url': 'https://external-preview.redd.it/3E9te2nqQifjA98pl_u9NW33LPElWihwLwcVT3gLAak.jpg?width=640&amp;crop=smart&amp;auto=webp&amp;s=914c76e11e614f09cbd552d1ecae8d3972458e12', 'width': 640}, {'height': 504, 'url': 'https://external-preview.redd.it/3E9te2nqQifjA98pl_u9NW33LPElWihwLwcVT3gLAak.jpg?width=960&amp;crop=smart&amp;auto=webp&amp;s=55a37a8332af3505b800e40922a23cb8d2a9f8c6', 'width': 960}, {'height': 567, 'url': 'https://external-preview.redd.it/3E9te2nqQifjA98pl_u9NW33LPElWihwLwcVT3gLAak.jpg?width=1080&amp;crop=smart&amp;auto=webp&amp;s=cbcc617e6c29e7bb03da7630a9b8042de183b887', 'width': 1080}], 'source': {'height': 630, 'url': 'https://external-preview.redd.it/3E9te2nqQifjA98pl_u9NW33LPElWihwLwcVT3gLAak.jpg?auto=webp&amp;s=f75bc6e6912f615f3a0c288a5645a47c93a65e97', 'width': 1200}, 'variants': {}}]}",6,1589504356,1,,,,True,False,False,nba,t5_2qo4s,3257718,public,default,73.0,140.0,Game of Zones Creators Adam and Craig Malamut Announce Next Week's Episode (S7E4) Will Be Series Finale,0,[],1.0,https://podcasts.apple.com/us/podcast/the-full-48/id1225356682?i=1000474208798,all_ads,6,,,,,,,,,,,,,,,,
278,[],False,mistercarder,,[],,text,t2_11jzp1qn,False,False,[],False,False,1589503903,wyretap.com,https://www.reddit.com/r/nba/comments/gjz61j/if_the_nba_season_is_over_which_players_suffer/,{},gjz61j,True,False,False,False,True,False,False,,[],dark,text,False,,,False,True,10,0,False,all_ads,/r/nba/comments/gjz61j/if_the_nba_season_is_over_which_players_suffer/,False,link,"{'enabled': False, 'images': [{'id': 'ojL3mxAjnTepzWUttkJlPU1HT_gAgI2MlkGIyqxZJ8Y', 'resolutions': [{'height': 72, 'url': 'https://external-preview.redd.it/ed2qamqsPOpj0zWMlFoto6AUaurOeisxmAblFNNj4NU.jpg?width=108&amp;crop=smart&amp;auto=webp&amp;s=3b916dd04465c541873ce215023f7157d66ffd97', 'width': 108}, {'height': 144, 'url': 'https://external-preview.redd.it/ed2qamqsPOpj0zWMlFoto6AUaurOeisxmAblFNNj4NU.jpg?width=216&amp;crop=smart&amp;auto=webp&amp;s=34938d83f8e271a30cf65806e7db9eeba238b5ca', 'width': 216}, {'height': 213, 'url': 'https://external-preview.redd.it/ed2qamqsPOpj0zWMlFoto6AUaurOeisxmAblFNNj4NU.jpg?width=320&amp;crop=smart&amp;auto=webp&amp;s=aa37129b9d8985571a3d099d0c7e2fcca81b3cbd', 'width': 320}, {'height': 426, 'url': 'https://external-preview.redd.it/ed2qamqsPOpj0zWMlFoto6AUaurOeisxmAblFNNj4NU.jpg?width=640&amp;crop=smart&amp;auto=webp&amp;s=98924f9342b4c83f8ec90af775c7467f359dfadf', 'width': 640}, {'height': 640, 'url': 'https://external-preview.redd.it/ed2qamqsPOpj0zWMlFoto6AUaurOeisxmAblFNNj4NU.jpg?width=960&amp;crop=smart&amp;auto=webp&amp;s=94bcdee0b5a800bf487ad4bd69635ea75e1175c3', 'width': 960}, {'height': 720, 'url': 'https://external-preview.redd.it/ed2qamqsPOpj0zWMlFoto6AUaurOeisxmAblFNNj4NU.jpg?width=1080&amp;crop=smart&amp;auto=webp&amp;s=d6edd56f739a6de21c77a272967367c1c395f1db', 'width': 1080}], 'source': {'height': 800, 'url': 'https://external-preview.redd.it/ed2qamqsPOpj0zWMlFoto6AUaurOeisxmAblFNNj4NU.jpg?auto=webp&amp;s=72df25124a92b957e961c20faed36369e1fc8f11', 'width': 1200}, 'variants': {}}]}",6,1589504199,1,,,,True,False,False,nba,t5_2qo4s,3257701,public,default,93.0,140.0,"If the NBA season is over, which players suffer and benefit? - WyreTap",0,[],1.0,https://wyretap.com/nba/if-the-nba-season-is-over-which-players-suffer-and-benefit/,all_ads,6,,,,,,,,,,,,,,,,
279,[],False,Varnagel_1,NBA,[],NBA,text,t2_10hw7oef,False,False,[],False,False,1589503763,self.nba,https://www.reddit.com/r/nba/comments/gjz4ow/is_jason_kidd_the_best_point_guard_ever_behind/,{},gjz4ow,True,False,False,False,True,True,False,,[],dark,text,False,,,False,True,76,0,False,all_ads,/r/nba/comments/gjz4ow/is_jason_kidd_the_best_point_guard_ever_behind/,False,,,6,1589504083,1,,,"The likes of Magic Johnson, Steph Curry &amp; Isiah Thomas are phenomenal players who actually won multiple Championship as the driving force on their teams. They are a seperate tier from other point guards in NBA history.

-----

As the title says, do you think Jason Kidd is NBA's 4th best point guard ever? He joined a struggling Nets team who only won 26 games and carried them to 2 straight NBA Finals. Which is remarkable accomplishment since Nets had no business going there

I haven't even said that Jason Kidd is a phenomenal playmaker who elevates his teammates around him + great defensive qualities.",True,False,False,nba,t5_2qo4s,3257702,public,self,,,Is Jason Kidd the best point guard ever behind Magic/Steph/Zeke?,0,[],0.67,https://www.reddit.com/r/nba/comments/gjz4ow/is_jason_kidd_the_best_point_guard_ever_behind/,all_ads,6,e5aa3fb6-3feb-11e8-8409-0ef728aaae7a,dark,,,,,,,,,,,,,,
280,[],False,IphoneBurlington,,[],,text,t2_4i7e56eu,False,False,[],False,False,1589503609,self.nba,https://www.reddit.com/r/nba/comments/gjz37j/what_do_you_guys_think_of_barstool_sports/,{},gjz37j,True,False,False,False,True,True,False,,[],dark,text,False,,,False,True,78,0,False,all_ads,/r/nba/comments/gjz37j/what_do_you_guys_think_of_barstool_sports/,False,,,6,1589503948,1,,,What do you guys think of Barstool sports? Do you like it? Dislike it? Why have people in sports media ignored it? (ESPN),True,False,False,nba,t5_2qo4s,3257701,public,self,,,What do you guys think of Barstool sports?,0,[],0.67,https://www.reddit.com/r/nba/comments/gjz37j/what_do_you_guys_think_of_barstool_sports/,all_ads,6,,,,,,,,,,,,,,,,
281,[],False,twelvefourtysix,Celtics1,[],Celtics,text,t2_4jbx34iw,False,False,[],False,False,1589503508,self.nba,https://www.reddit.com/r/nba/comments/gjz2b1/most_overrated_players_in_the_league/,{},gjz2b1,True,False,False,False,True,True,False,,[],dark,text,False,,,False,False,109,0,False,all_ads,/r/nba/comments/gjz2b1/most_overrated_players_in_the_league/,False,,,6,1589503864,4,,,"Here’s my hot take: Luka Doncic. 


He’s no doubt a great player. Top 7 for sure. Future hall of famer. But he does rely on the free throw a good bit to maintain his (above average) but not elite efficiency. He’s not a great shooter, but he’s willing to take the three. Add this onto neutral defensive impact at best, and you have a pretty good recipe for a future “choker” narrative.


The whistle tightens up a ton in the playoffs and an over reliance on the line has hurt Harden a ton in the playoffs (not the only factor, but one of them) I think the same will happen to Luka. 



Who do you think is overrated?",True,False,False,nba,t5_2qo4s,3257700,public,self,,,Most overrated players in the league,0,[],0.83,https://www.reddit.com/r/nba/comments/gjz2b1/most_overrated_players_in_the_league/,all_ads,6,ba15b588-3feb-11e8-91f6-0e2585a98bf6,dark,,,,,,,,,,,,,,
282,[],False,imiweli,Knicks2,[],Knicks,text,t2_dtp6m,False,False,[],False,False,1589503477,self.nba,https://www.reddit.com/r/nba/comments/gjz20e/if_the_season_is_cancelled_are_the_warriors_the/,{},gjz20e,True,False,False,False,True,True,False,,[],dark,text,False,,,False,True,24,0,False,all_ads,/r/nba/comments/gjz20e/if_the_season_is_cancelled_are_the_warriors_the/,False,,,6,1589503840,1,,,"Assuming no title is awarded

Curry got some much needed time off after 5 title runs

Klay suffered a major injury and will miss no important games. He should be ready to go when the next season eventually starts

They finished with the worst record in the league so they'll have the best odds to get the number one pick

They were going to lose Durant for nothing but managed to turn him into Wiggins. Wiggins isn't anything special but he'll be the 3rd option at best and is better than any MLE player they could've got

The whole franchise as a whole gets break from 5 title runs and can rejuvenate physically and mentally. Kerr in particular seemed worn out

They got to see what they had in some of the younger guys",True,False,False,nba,t5_2qo4s,3257701,public,self,,,"If the season is cancelled, are the Warriors the biggest winner?",0,[],1.0,https://www.reddit.com/r/nba/comments/gjz20e/if_the_season_is_cancelled_are_the_warriors_the/,all_ads,6,,dark,,,,,,,,,,,,,,
283,[],False,Redemptionmes,,[],,text,t2_1o7l2h7o,False,False,[],False,False,1589503457,self.nba,https://www.reddit.com/r/nba/comments/gjz1r0/how_famous_are_guys_like_lebron_and_curry_outside/,{},gjz1r0,True,False,False,False,True,True,False,,[],dark,text,False,,,False,True,6,0,False,all_ads,/r/nba/comments/gjz1r0/how_famous_are_guys_like_lebron_and_curry_outside/,False,,,6,1589503818,1,,,"Everyone and their granny knows Messi, Ronaldo and hell even second tier greats like Neymar are known to most people in the world. Is Lebron on that same level?",True,False,False,nba,t5_2qo4s,3257701,public,self,,,How famous are guys like Lebron and Curry outside America?,0,[],1.0,https://www.reddit.com/r/nba/comments/gjz1r0/how_famous_are_guys_like_lebron_and_curry_outside/,all_ads,6,,,,,,,,,,,,,,,,
284,[],False,www123x,Knicks2,[],Knicks,text,t2_3q23v5me,False,False,[],False,False,1589503324,self.nba,https://www.reddit.com/r/nba/comments/gjz0fn/michael_wilbon_believes_scottie_pippen_was_a/,{},gjz0fn,True,False,False,False,True,True,False,,[],dark,text,False,,,False,False,60,0,False,all_ads,/r/nba/comments/gjz0fn/michael_wilbon_believes_scottie_pippen_was_a/,False,,,6,1589503703,2,,,"Yesterday on ESPN, Wilbon cited Garnett being ranked over Pippen as one of his disagreements with ESPN’s recent ranking of top 74 greatest players of all time. I really don’t understand this take. Is there even an argument for Pippen over Garnett? Is Wilbon just being a Chicago homer?",True,False,False,nba,t5_2qo4s,3257701,public,self,,,Michael Wilbon believes Scottie Pippen was a better player than Kevin Garnett,0,[],1.0,https://www.reddit.com/r/nba/comments/gjz0fn/michael_wilbon_believes_scottie_pippen_was_a/,all_ads,6,d592767a-3feb-11e8-a2cf-0e5e504bb706,dark,,,,,,,,,,,,,,
285,[],False,[deleted],,,,,,,,[],False,False,1589502960,self.nba,https://www.reddit.com/r/nba/comments/gjywqa/who_would_you_rather_draft_james_wiseman_or/,{},gjywqa,False,False,False,False,False,True,False,,[],dark,text,False,,,False,True,2,0,False,all_ads,/r/nba/comments/gjywqa/who_would_you_rather_draft_james_wiseman_or/,False,,,6,1589503390,1,,,[deleted],True,False,False,nba,t5_2qo4s,3257700,public,default,,,"Who would you rather draft, James Wiseman or Lamelo Ball?",0,[],1.0,https://www.reddit.com/r/nba/comments/gjywqa/who_would_you_rather_draft_james_wiseman_or/,all_ads,6,,dark,,,,,deleted,,,,,,,,,
286,[],False,KobeKnox,,[],,text,t2_623ylgqh,False,False,[],False,False,1589502882,self.nba,https://www.reddit.com/r/nba/comments/gjyvw0/the_season_before_they_all_joined_up_2009_lebron/,{},gjyvw0,False,False,False,False,False,True,False,,[],dark,text,False,,,False,True,2,0,False,all_ads,/r/nba/comments/gjyvw0/the_season_before_they_all_joined_up_2009_lebron/,False,,,6,1589503320,1,,,[removed],True,False,False,nba,t5_2qo4s,3257700,public,self,,,"The season before they all joined up (2009), Lebron averaged 29.7/8.6/7.3, Wade averaged 26.6/6.5/4.8, and Bosh averaged 24.0/2.4/10.8",0,[],1.0,https://www.reddit.com/r/nba/comments/gjyvw0/the_season_before_they_all_joined_up_2009_lebron/,all_ads,6,,,,,,,moderator,,,,,,,,,
287,[],False,KlayThompsonBetterSG,,[],,text,t2_5wp53ywu,False,False,[],False,False,1589502810,self.nba,https://www.reddit.com/r/nba/comments/gjyv4n/which_of_these_pickup_teams_do_you_think_would_go/,{},gjyv4n,False,False,False,False,False,True,False,,[],dark,text,False,,,False,True,0,0,False,all_ads,/r/nba/comments/gjyv4n/which_of_these_pickup_teams_do_you_think_would_go/,False,,,6,1589503260,1,,,[removed],True,False,False,nba,t5_2qo4s,3257700,public,self,,,Which of these Pickup Teams do you think would go furthest in the gauntlet?,0,[],1.0,https://www.reddit.com/r/nba/comments/gjyv4n/which_of_these_pickup_teams_do_you_think_would_go/,all_ads,6,,,,,,,moderator,,,,,,,,,
288,[],False,messejueller21,Bucks4,[],Bucks,text,t2_dpwta,False,False,[],False,False,1589502579,self.nba,https://www.reddit.com/r/nba/comments/gjyspo/no_team_has_scored_90_points_in_the_ncaa_national/,{},gjyspo,True,False,False,False,True,True,False,,[],dark,text,False,,,False,True,20,0,False,all_ads,/r/nba/comments/gjyspo/no_team_has_scored_90_points_in_the_ncaa_national/,False,,,6,1589503053,1,,,"Obviously not NBA related..but it's crazy to think of the disparity in scoring between NCAA and NBA.

UNLV was the last team to score 90 in a National Championship game in 1990. 103-73",True,False,False,nba,t5_2qo4s,3257698,public,self,,,No team has scored 90 points in the NCAA National Championship in 30 years.,0,[],1.0,https://www.reddit.com/r/nba/comments/gjyspo/no_team_has_scored_90_points_in_the_ncaa_national/,all_ads,6,d12d5b7c-3feb-11e8-bea9-0ef947828ac4,dark,,,,,,,,,,,,,,
289,[],False,andy3172,Clippers2,[],Clippers,text,t2_i2rhs,False,False,[],False,False,1589502405,self.nba,https://www.reddit.com/r/nba/comments/gjyqyv/i_decided_to_illustrate_five_of_our_nbas_best/,{},gjyqyv,True,False,False,False,True,True,False,,[],dark,text,False,,,False,False,25,0,False,all_ads,/r/nba/comments/gjyqyv/i_decided_to_illustrate_five_of_our_nbas_best/,False,self,"{'enabled': False, 'images': [{'id': '2SF-B1QeAUCzbwOslJ_I1M1ikt4Q9zE9nzOck-wnKts', 'resolutions': [{'height': 162, 'url': 'https://external-preview.redd.it/DtQ_eSq0OucN51v3WqgQYjeu5BYL_3IyL3omDay1uL8.jpg?width=108&amp;crop=smart&amp;auto=webp&amp;s=25f26578b6dfefaca58ee9900224b1eac13f4fcb', 'width': 108}, {'height': 324, 'url': 'https://external-preview.redd.it/DtQ_eSq0OucN51v3WqgQYjeu5BYL_3IyL3omDay1uL8.jpg?width=216&amp;crop=smart&amp;auto=webp&amp;s=64fd9a2a2b6021a60973bd85511c2cb4e9fd1d1d', 'width': 216}, {'height': 480, 'url': 'https://external-preview.redd.it/DtQ_eSq0OucN51v3WqgQYjeu5BYL_3IyL3omDay1uL8.jpg?width=320&amp;crop=smart&amp;auto=webp&amp;s=707feb3dbb1e54140af962abe0c98269e1ac0f60', 'width': 320}, {'height': 960, 'url': 'https://external-preview.redd.it/DtQ_eSq0OucN51v3WqgQYjeu5BYL_3IyL3omDay1uL8.jpg?width=640&amp;crop=smart&amp;auto=webp&amp;s=c70b871580df91d2c3f4e3345a7fbf6d8567e08a', 'width': 640}, {'height': 1440, 'url': 'https://external-preview.redd.it/DtQ_eSq0OucN51v3WqgQYjeu5BYL_3IyL3omDay1uL8.jpg?width=960&amp;crop=smart&amp;auto=webp&amp;s=520176ef5b93041685ac5e3b4eea1fa8924ecf32', 'width': 960}, {'height': 1620, 'url': 'https://external-preview.redd.it/DtQ_eSq0OucN51v3WqgQYjeu5BYL_3IyL3omDay1uL8.jpg?width=1080&amp;crop=smart&amp;auto=webp&amp;s=b0ef71f1c0ac0e359910c96a0f3871a09ee01a40', 'width': 1080}], 'source': {'height': 2100, 'url': 'https://external-preview.redd.it/DtQ_eSq0OucN51v3WqgQYjeu5BYL_3IyL3omDay1uL8.jpg?auto=webp&amp;s=0ba6c32b01cd32b40c0a16ea14c1e270078ac460', 'width': 1400}, 'variants': {}}]}",6,1589502905,5,,,"TLDR: The players I did were: **Michael Jordan, LeBron James, Giannis Antetokounmpo, Steph Curry and Kawhi Leonard.**

Hey guys, 

With the free time this situation has given me, I decided to do some vector illustrations of a few of the best players in the league today (plus MJ). Each piece took roughly between 10 - 15 hours to create. It was a very long, slow process doing each minor shape that felt like you'd never even see it, but after zooming out to see the bigger picture I was super happy with the outcome. 

https://www.behance.net/gallery/97133037/NBA-Player-Vectors

EDIT: Also, sorry this isn't just a simple imgur post. I've tried that before but the auto-mod doesn't let me.",True,False,False,nba,t5_2qo4s,3257695,public,self,,,I decided to illustrate five of our NBA's best players.,0,[],1.0,https://www.reddit.com/r/nba/comments/gjyqyv/i_decided_to_illustrate_five_of_our_nbas_best/,all_ads,6,cac9016e-3feb-11e8-a1e8-0e230585c740,dark,1589502856.0,,,,,,,,,,,,,
