,all_awardings,allow_live_comments,author,author_flair_css_class,author_flair_richtext,author_flair_text,author_flair_type,author_fullname,author_patreon_flair,author_premium,awarders,can_mod_post,contest_mode,created_utc,domain,full_link,gildings,id,is_crosspostable,is_meta,is_original_content,is_reddit_media_domain,is_robot_indexable,is_self,is_video,link_flair_background_color,link_flair_richtext,link_flair_text_color,link_flair_type,locked,media,media_embed,media_only,no_follow,num_comments,num_crossposts,over_18,parent_whitelist_status,permalink,pinned,post_hint,preview,pwls,retrieved_on,score,secure_media,secure_media_embed,selftext,send_replies,spoiler,stickied,subreddit,subreddit_id,subreddit_subscribers,subreddit_type,thumbnail,thumbnail_height,thumbnail_width,title,total_awards_received,treatment_tags,upvote_ratio,url,whitelist_status,wls,author_flair_template_id,author_flair_text_color,edited,link_flair_css_class,link_flair_text,author_flair_background_color,removed_by_category,banned_by,crosspost_parent,crosspost_parent_list,author_cakeday,media_metadata,event_end,event_is_live,event_start,suggested_sort
0,[],False,SirCharles54,,[],,text,t2_3cl4ycr1,False,False,[],False,False,1589568817,youtube.com,https://www.reddit.com/r/nba/comments/gkf35k/kawhi_leonards_playoff_run_2019_postseason_heroics/,{},gkf35k,True,False,False,False,True,False,False,,[],dark,text,False,"{'oembed': {'author_name': 'NBA', 'author_url': 'https://www.youtube.com/user/NBA', 'height': 338, 'html': '&lt;iframe width=""600"" height=""338"" src=""https://www.youtube.com/embed/IHOConM6RQE?feature=oembed&amp;enablejsapi=1"" frameborder=""0"" allow=""accelerometer; autoplay; encrypted-media; gyroscope; picture-in-picture"" allowfullscreen&gt;&lt;/iframe&gt;', 'provider_name': 'YouTube', 'provider_url': 'https://www.youtube.com/', 'thumbnail_height': 360, 'thumbnail_url': 'https://i.ytimg.com/vi/IHOConM6RQE/hqdefault.jpg', 'thumbnail_width': 480, 'title': ""Kawhi Leonard's 🔥 Playoff Run 2019 | Postseason Heroics"", 'type': 'video', 'version': '1.0', 'width': 600}, 'type': 'youtube.com'}","{'content': '&lt;iframe width=""600"" height=""338"" src=""https://www.youtube.com/embed/IHOConM6RQE?feature=oembed&amp;enablejsapi=1"" frameborder=""0"" allow=""accelerometer; autoplay; encrypted-media; gyroscope; picture-in-picture"" allowfullscreen&gt;&lt;/iframe&gt;', 'height': 338, 'scrolling': False, 'width': 600}",False,True,0,0,False,all_ads,/r/nba/comments/gkf35k/kawhi_leonards_playoff_run_2019_postseason_heroics/,False,rich:video,"{'enabled': False, 'images': [{'id': '9ZohJpZXbXgJCOqavw-S6y-Obz-RZLPGALQS3wCgY_Q', 'resolutions': [{'height': 81, 'url': 'https://external-preview.redd.it/lO92cJDtQDUtkB7DInhWYu2oBgYuVxSIgPADp0k_psU.jpg?width=108&amp;crop=smart&amp;auto=webp&amp;s=da99bb93257534277c42598f8402d8f9c3e7050c', 'width': 108}, {'height': 162, 'url': 'https://external-preview.redd.it/lO92cJDtQDUtkB7DInhWYu2oBgYuVxSIgPADp0k_psU.jpg?width=216&amp;crop=smart&amp;auto=webp&amp;s=f541d54da2f12ef9b58c949637db542717e8e9f1', 'width': 216}, {'height': 240, 'url': 'https://external-preview.redd.it/lO92cJDtQDUtkB7DInhWYu2oBgYuVxSIgPADp0k_psU.jpg?width=320&amp;crop=smart&amp;auto=webp&amp;s=ff871ec45576624d730e20c83720188a5b312014', 'width': 320}], 'source': {'height': 360, 'url': 'https://external-preview.redd.it/lO92cJDtQDUtkB7DInhWYu2oBgYuVxSIgPADp0k_psU.jpg?auto=webp&amp;s=ccfbad402f613481ce2a52eba62a641b6bdc309f', 'width': 480}, 'variants': {}}]}",6,1589571778,1,"{'oembed': {'author_name': 'NBA', 'author_url': 'https://www.youtube.com/user/NBA', 'height': 338, 'html': '&lt;iframe width=""600"" height=""338"" src=""https://www.youtube.com/embed/IHOConM6RQE?feature=oembed&amp;enablejsapi=1"" frameborder=""0"" allow=""accelerometer; autoplay; encrypted-media; gyroscope; picture-in-picture"" allowfullscreen&gt;&lt;/iframe&gt;', 'provider_name': 'YouTube', 'provider_url': 'https://www.youtube.com/', 'thumbnail_height': 360, 'thumbnail_url': 'https://i.ytimg.com/vi/IHOConM6RQE/hqdefault.jpg', 'thumbnail_width': 480, 'title': ""Kawhi Leonard's 🔥 Playoff Run 2019 | Postseason Heroics"", 'type': 'video', 'version': '1.0', 'width': 600}, 'type': 'youtube.com'}","{'content': '&lt;iframe width=""600"" height=""338"" src=""https://www.youtube.com/embed/IHOConM6RQE?feature=oembed&amp;enablejsapi=1"" frameborder=""0"" allow=""accelerometer; autoplay; encrypted-media; gyroscope; picture-in-picture"" allowfullscreen&gt;&lt;/iframe&gt;', 'height': 338, 'media_domain_url': 'https://www.redditmedia.com/mediaembed/gkf35k', 'scrolling': False, 'width': 600}",,True,False,False,nba,t5_2qo4s,3259343,public,image,105.0,140.0,Kawhi Leonard's 🔥 Playoff Run 2019 | Postseason Heroics,0,[],0.6,https://www.youtube.com/watch?v=IHOConM6RQE&amp;feature=emb_title,all_ads,6,,,,,,,,,,,,,,,,
1,[],False,Actlikeyouknow210,,[],,text,t2_6718prox,False,False,[],False,False,1589568794,mysanantonio.com,https://www.reddit.com/r/nba/comments/gkf2us/ill_tell_all_of_san_antonio_shaq_explains_why_he/,{},gkf2us,True,False,False,False,True,False,False,,[],dark,text,False,,,False,True,53,0,False,all_ads,/r/nba/comments/gkf2us/ill_tell_all_of_san_antonio_shaq_explains_why_he/,False,,,6,1589571756,0,,,,True,False,False,nba,t5_2qo4s,3259343,public,default,,,'I’ll tell all of San Antonio': Shaq explains why he doesn't count the Spurs' 1999 title,0,[],0.33,https://www.mysanantonio.com/sports/article/I-ll-tell-all-of-San-Antonio-Shaq-explains-15272556.php?utm_campaign=CMS%20Sharing%20Tools%20(Mobile)&amp;utm_source=reddit.com&amp;utm_medium=referral,all_ads,6,,,,,,,,,,,,,,,,
2,[],False,AmuroRay0704,,[],,text,t2_4iq9h5ti,False,False,[],False,False,1589568748,self.nba,https://www.reddit.com/r/nba/comments/gkf2av/you_can_change_3_momentsevents_in_nba_history/,{},gkf2av,True,False,False,False,True,True,False,,[],dark,text,False,,,False,True,50,0,False,all_ads,/r/nba/comments/gkf2av/you_can_change_3_momentsevents_in_nba_history/,False,,,6,1589571717,1,,,"They can be anything you wish, from Awards, to Buzzer Beaters, trades/signings, retirements. Pretty much anything relating to the NBA.

However, if it's about a player, they have to be relevant to the NBA , so no reviving Kobe. He was retired already and his career was over.",True,False,False,nba,t5_2qo4s,3259343,public,self,,,"You can change 3 moments/events in NBA History, what do you change?",0,[],0.67,https://www.reddit.com/r/nba/comments/gkf2av/you_can_change_3_momentsevents_in_nba_history/,all_ads,6,,,,,,,,,,,,,,,,
3,[],False,futbolfan3,,[],,text,t2_aw8m3we,False,False,[],False,False,1589568730,self.nba,https://www.reddit.com/r/nba/comments/gkf22s/if_you_havent_read_this_article_about_joel_i/,{},gkf22s,True,False,False,False,True,True,False,,[],dark,text,False,,,False,True,5,0,False,all_ads,/r/nba/comments/gkf22s/if_you_havent_read_this_article_about_joel_i/,False,,,6,1589571698,0,,,"http://projects.theplayerstribune.com/joel-embiid-the-only-way-is-through/p/1

This article reveals so much about Joel. I know it was posted a while ago, but I came across it again today due to him being discussed. Many people here might not have read it l, so I’m posting it because I think everyone should if they have time",True,False,False,nba,t5_2qo4s,3259343,public,self,,,"If you haven’t read this article about Joel, I highly recommend doing so",0,[],0.5,https://www.reddit.com/r/nba/comments/gkf22s/if_you_havent_read_this_article_about_joel_i/,all_ads,6,,,,,,,,,,,,,,,,
4,[],False,crabcakemd,Magic3,[],Magic,text,t2_56792yf2,False,False,[],False,False,1589568725,self.nba,https://www.reddit.com/r/nba/comments/gkf20o/if_philly_took_tatum_at_1_in_the_2017_draft_that/,{},gkf20o,True,False,False,False,True,True,False,,[],dark,text,False,,,False,True,25,0,False,all_ads,/r/nba/comments/gkf20o/if_philly_took_tatum_at_1_in_the_2017_draft_that/,False,,,6,1589571692,0,,,"Would the Sixers have ever traded for Butler/Harris or signed Horford? Could they have made a move for someone else? Having Joel, Ben and Tatum would be a pretty good big three. Another question: how would they compare to Milwaukee in the east and the two LA teams in the west?",True,False,False,nba,t5_2qo4s,3259343,public,self,,,"If Philly took Tatum at #1 in the 2017 draft, that would give them Tatum, Embiid and Simmons. What happens from there?",0,[],0.5,https://www.reddit.com/r/nba/comments/gkf20o/if_philly_took_tatum_at_1_in_the_2017_draft_that/,all_ads,6,d8f4acb6-3feb-11e8-ad32-0e94ee509f38,dark,,,,,,,,,,,,,,
5,[],False,raahiv,TrailBlazers4,[],Trail Blazers,text,t2_2kl1mwhs,False,False,[],False,False,1589568294,self.nba,https://www.reddit.com/r/nba/comments/gkex6e/aight_rnba_im_insanely_bored_rn_so_i_got_a/,{},gkex6e,True,False,False,False,True,True,False,,[],dark,text,False,,,False,False,41,0,False,all_ads,/r/nba/comments/gkex6e/aight_rnba_im_insanely_bored_rn_so_i_got_a/,False,,,6,1589571294,2,,,"Horry was only on 4 teams throughout his career but he won 7 championships with 3 different teams. Rockets, Spurs, Lakers. He only averaged 7, 5, and 2 over his career but he made so many clutch shots, for every team he was on. There’s definitely guys with better stats but he was just such a good role player that you could count on in clutch situations.

I was trying to decide between Andre Miller and Horry and I ultimately ended up going with Horry. Miller on 9 different teams over his career and he averaged 12.5, 4, and 6.5 over his career. He’s one of the greatest passers, sits at #11 on the all-time list. While stats wise he was a much better player then Horry, Miller never had the type of success that Horry did which is why I have him at second.

Edit: A lot of people are saying all time greats as the best journeyman and here’s why I don’t agree. With guys like Wilkins, Moses Malone, Dantley, and Ray Allen I feel like they’re too good to be considered journeymen. When I think of a journeyman I think of a reliable role player that moved around a lot. If you look at the guys I said even later in their careers even if they moved around most of them were still 1st or second options.",True,False,False,nba,t5_2qo4s,3259317,public,self,,,"Aight r/NBA I’m insanely bored rn so I got a question for you all. Who is your ultimate NBA journeyman. Consider amount of teams, stats, championships, and overall impact. I gotta go with Big Shot Bob.",0,[],0.67,https://www.reddit.com/r/nba/comments/gkex6e/aight_rnba_im_insanely_bored_rn_so_i_got_a/,all_ads,6,dd8463c0-3feb-11e8-a4d9-0e057b5e85fa,dark,1589570402.0,discussion,Stats,,,,,,,,,,,
6,[],False,Fibromyalgia11,,[],,text,t2_2n9e74xb,False,False,[],False,False,1589568226,fivethirtyeight.com,https://www.reddit.com/r/nba/comments/gkewfx/people_told_mj_that_he_wasnt_really_a_good/,{},gkewfx,True,False,False,False,True,False,False,,[],dark,text,False,,,False,False,7,0,False,all_ads,/r/nba/comments/gkewfx/people_told_mj_that_he_wasnt_really_a_good/,False,,,6,1589571230,2,,,,True,False,False,nba,t5_2qo4s,3259310,public,default,,,"""People told [MJ] that he wasn’t really a good defensive player,” Phil Jackson said. “And he found a way not only to become a great defensive player, but the best defensive player in the NBA.""",0,[],0.58,https://fivethirtyeight.com/features/why-michael-jordan-was-the-best/,all_ads,6,,,,discussion,Analysis,,,,,,,,,,,
7,[],False,[deleted],,,,,,,,[],False,False,1589568174,fivethirtyeight.com,https://www.reddit.com/r/nba/comments/gkevwr/people_told_mj_that_he_wasnt_really_a_good/,{},gkevwr,False,False,False,False,False,False,False,,[],dark,text,False,,,False,True,0,0,False,all_ads,/r/nba/comments/gkevwr/people_told_mj_that_he_wasnt_really_a_good/,False,,,6,1589571183,1,,,[deleted],True,False,False,nba,t5_2qo4s,3259304,public,default,,,"""People told [MJ] that he wasn’t really a good defensive player,” Jackson said. “And he found a way not only to become a great defensive player, but the best defensive player in the NBA.""",0,[],1.0,https://fivethirtyeight.com/features/why-michael-jordan-was-the-best/,all_ads,6,,dark,,discussion,Analysis,,deleted,,,,,,,,,
8,[],False,LivingLambeaux,,[],,text,t2_40t4zfv4,False,False,[],False,False,1589568165,self.nba,https://www.reddit.com/r/nba/comments/gkevt1/alltime_franchise_lists_how_do_you_value_good/,{},gkevt1,True,False,False,False,True,True,False,,[],dark,text,False,,,False,True,8,0,False,all_ads,/r/nba/comments/gkevt1/alltime_franchise_lists_how_do_you_value_good/,False,,,6,1589571174,0,,,"With no basketball I’ve recently started thinking about my franchises all time best players, at every position. Now the thing I keep arriving at is my franchise isn’t the Lakers, we don’t have 10 HOF’s at every position. A lot of the time it comes down to a guy that played 1 season (or less) and a guy like played, say 4 seasons. So given the numbers below, who would you value more in terms of a All-Time list?

Player A: 68 games, 1200 points, 580 rbs, or 18 pts and 9 rbs a night

Player B: 328 games, 2,296 pts, 1,300 rbs, or 7 pts and 4 rbs a night 

So player A is the better player, but player B played 260 more games for this given franchise.

Am I over thinking it and player B deserves to be higher simply because he was a rotation player (say 7th or 8th man?) for multiple seasons?",True,False,False,nba,t5_2qo4s,3259304,public,self,,,All-Time franchise lists: how do you value good short term production vs average long term production?,0,[],0.5,https://www.reddit.com/r/nba/comments/gkevt1/alltime_franchise_lists_how_do_you_value_good/,all_ads,6,,,,,,,,,,,,,,,,
9,[],False,[deleted],,,,,,,,[],False,False,1589568128,fivethirtyeight.com,https://www.reddit.com/r/nba/comments/gkevdz/people_told_mj_was_that_he_wasnt_really_a_good/,{},gkevdz,False,False,False,False,False,False,False,,[],dark,text,False,,,False,True,0,0,False,all_ads,/r/nba/comments/gkevdz/people_told_mj_was_that_he_wasnt_really_a_good/,False,,,6,1589571140,1,,,[deleted],True,False,False,nba,t5_2qo4s,3259301,public,default,,,"""People told [MJ] was that he wasn’t really a good defensive player,” Phil Jackson said. “And he found a way not only to become a great defensive player, but the best defensive player in the NBA.""",0,[],1.0,https://fivethirtyeight.com/features/why-michael-jordan-was-the-best/,all_ads,6,,dark,,discussion,Analysis,,deleted,,,,,,,,,
10,[],False,Hesospecial,,[],,text,t2_ti6dq,False,False,[],False,False,1589567681,self.nba,https://www.reddit.com/r/nba/comments/gkeqcj/kobe_is_an_underrated_part_of_jordans_legacy/,{},gkeqcj,True,False,False,False,True,True,False,,[],dark,text,False,,,False,True,24,0,False,all_ads,/r/nba/comments/gkeqcj/kobe_is_an_underrated_part_of_jordans_legacy/,False,,,6,1589570739,0,,,"I, like many of you watched Kobe's segment on the last dance. The one thing that blew me away about it the most was how honest and humble he was about Jordan's tutelage and impact on his career as a basketball player. The follow up story by ESPN was even better. It described how a young Kobe would seek Jordan out anytime they played each other, often keeping the team bus waiting for hours as he waited for the chance to pick Jordan's mind. Jordan weary at first,eventually gave into their mentor/protege relationship giving his young pupil different skills to work on and even breaking down the intricacies of the triangle offense. Kobe ended up taking Jordan's blue print and tutelage, and becoming a top 10 player of all time in his own right. Sure players have inspired one another before,but has any player ever helped mold their disciple in such a successful manner before? I think this may be one of the most impressive parts of his lasting legacy, his ""clone"" ended up being one of the best players the league has ever seen.",True,False,False,nba,t5_2qo4s,3259288,public,self,,,Kobe is an underrated part of Jordan's legacy,0,[],0.29,https://www.reddit.com/r/nba/comments/gkeqcj/kobe_is_an_underrated_part_of_jordans_legacy/,all_ads,6,,,,,,,,,,,,,,,,
11,[],False,jgill2,,[],,text,t2_9fh1g,False,False,[],False,False,1589567281,twitter.com,https://www.reddit.com/r/nba/comments/gkelvk/heres_something_crazy_this_is_vince_carter_in_a/,{},gkelvk,False,False,False,False,False,False,False,,[],dark,text,False,"{'oembed': {'author_name': 'Jeewan Gill', 'author_url': 'https://twitter.com/jgillcomedy', 'cache_age': 3153600000, 'height': None, 'html': '&lt;blockquote class=""twitter-video""&gt;&lt;p lang=""en"" dir=""ltr""&gt;Here&amp;#39;s something crazy. This is Vince Carter in a video game in his first season and his last. &lt;a href=""https://t.co/DYchi8gGSS""&gt;pic.twitter.com/DYchi8gGSS&lt;/a&gt;&lt;/p&gt;&amp;mdash; Jeewan Gill (@jgillcomedy) &lt;a href=""https://twitter.com/jgillcomedy/status/1260954890173644801?ref_src=twsrc%5Etfw""&gt;May 14, 2020&lt;/a&gt;&lt;/blockquote&gt;\n&lt;script async src=""https://platform.twitter.com/widgets.js"" charset=""utf-8""&gt;&lt;/script&gt;\n', 'provider_name': 'Twitter', 'provider_url': 'https://twitter.com', 'type': 'rich', 'url': 'https://twitter.com/jgillcomedy/status/1260954890173644801', 'version': '1.0', 'width': 350}, 'type': 'twitter.com'}","{'content': '&lt;blockquote class=""twitter-video""&gt;&lt;p lang=""en"" dir=""ltr""&gt;Here&amp;#39;s something crazy. This is Vince Carter in a video game in his first season and his last. &lt;a href=""https://t.co/DYchi8gGSS""&gt;pic.twitter.com/DYchi8gGSS&lt;/a&gt;&lt;/p&gt;&amp;mdash; Jeewan Gill (@jgillcomedy) &lt;a href=""https://twitter.com/jgillcomedy/status/1260954890173644801?ref_src=twsrc%5Etfw""&gt;May 14, 2020&lt;/a&gt;&lt;/blockquote&gt;\n&lt;script async src=""https://platform.twitter.com/widgets.js"" charset=""utf-8""&gt;&lt;/script&gt;\n', 'height': 200, 'scrolling': False, 'width': 350}",False,True,0,0,False,all_ads,/r/nba/comments/gkelvk/heres_something_crazy_this_is_vince_carter_in_a/,False,link,"{'enabled': False, 'images': [{'id': 'qnBxZffiX12aUmLwbDZdc9aHjz5BBkgZBFn0oHR_tnw', 'resolutions': [{'height': 108, 'url': 'https://external-preview.redd.it/ei42fXEQmzEFJc6baBlWlHkvScSuKz-9hCaPLzCa_qw.jpg?width=108&amp;crop=smart&amp;auto=webp&amp;s=c421b0b6a1553ebf87daa6e0235bbe123f92b654', 'width': 108}], 'source': {'height': 140, 'url': 'https://external-preview.redd.it/ei42fXEQmzEFJc6baBlWlHkvScSuKz-9hCaPLzCa_qw.jpg?auto=webp&amp;s=6fe6d59d101be57c5f7717eb8f9f213d74de6554', 'width': 140}, 'variants': {}}]}",6,1589570373,1,"{'oembed': {'author_name': 'Jeewan Gill', 'author_url': 'https://twitter.com/jgillcomedy', 'cache_age': 3153600000, 'height': None, 'html': '&lt;blockquote class=""twitter-video""&gt;&lt;p lang=""en"" dir=""ltr""&gt;Here&amp;#39;s something crazy. This is Vince Carter in a video game in his first season and his last. &lt;a href=""https://t.co/DYchi8gGSS""&gt;pic.twitter.com/DYchi8gGSS&lt;/a&gt;&lt;/p&gt;&amp;mdash; Jeewan Gill (@jgillcomedy) &lt;a href=""https://twitter.com/jgillcomedy/status/1260954890173644801?ref_src=twsrc%5Etfw""&gt;May 14, 2020&lt;/a&gt;&lt;/blockquote&gt;\n&lt;script async src=""https://platform.twitter.com/widgets.js"" charset=""utf-8""&gt;&lt;/script&gt;\n', 'provider_name': 'Twitter', 'provider_url': 'https://twitter.com', 'type': 'rich', 'url': 'https://twitter.com/jgillcomedy/status/1260954890173644801', 'version': '1.0', 'width': 350}, 'type': 'twitter.com'}","{'content': '&lt;blockquote class=""twitter-video""&gt;&lt;p lang=""en"" dir=""ltr""&gt;Here&amp;#39;s something crazy. This is Vince Carter in a video game in his first season and his last. &lt;a href=""https://t.co/DYchi8gGSS""&gt;pic.twitter.com/DYchi8gGSS&lt;/a&gt;&lt;/p&gt;&amp;mdash; Jeewan Gill (@jgillcomedy) &lt;a href=""https://twitter.com/jgillcomedy/status/1260954890173644801?ref_src=twsrc%5Etfw""&gt;May 14, 2020&lt;/a&gt;&lt;/blockquote&gt;\n&lt;script async src=""https://platform.twitter.com/widgets.js"" charset=""utf-8""&gt;&lt;/script&gt;\n', 'height': 200, 'media_domain_url': 'https://www.redditmedia.com/mediaembed/gkelvk', 'scrolling': False, 'width': 350}",,False,False,False,nba,t5_2qo4s,3259285,public,default,140.0,140.0,Here's something crazy. This is Vince Carter in a video game in his first season and his last,0,[],1.0,https://twitter.com/jgillcomedy/status/1260954890173644801?s=19,all_ads,6,,,,,,,moderator,,,,,,,,,
12,[],False,[deleted],,,,,,,,[],False,False,1589567205,self.nba,https://www.reddit.com/r/nba/comments/gkel00/russ_not_on_maxs_top_10_players_list/,{},gkel00,False,False,False,False,False,True,False,,[],dark,text,False,,,False,True,1,0,False,all_ads,/r/nba/comments/gkel00/russ_not_on_maxs_top_10_players_list/,False,,,6,1589570305,1,,,,True,False,False,nba,t5_2qo4s,3259285,public,default,,,Russ not on Max's top 10 players list,0,[],1.0,https://www.reddit.com/r/nba/comments/gkel00/russ_not_on_maxs_top_10_players_list/,all_ads,6,,dark,,,,,deleted,moderators,,,,,,,,
13,[],False,connie-lingus38,Pelicans3,[],Pelicans,text,t2_4djg7amv,False,False,[],False,False,1589567100,self.nba,https://www.reddit.com/r/nba/comments/gkejsw/euroleague_vs_nba_kind_of_serious/,{},gkejsw,True,False,False,False,True,True,False,,[],dark,text,False,,,False,True,44,0,False,all_ads,/r/nba/comments/gkejsw/euroleague_vs_nba_kind_of_serious/,False,,,6,1589570207,1,,,"I don't know a lot about the euroleague and I am trying to educate myself on it. The nick nurse journey in particular, really turned me on to international basketball. 

Just curious to what the level of competition is in the euroleague. 

1. How many players could play in the NBA, and how many would be starters, important role players or just end of the bench guys.

2. Could a euroleague team like Real Madrid compete in the NBA and make the 8th seed in the east?.

3. What would an all star like LeBron average if he was to go over there in his prime.",True,False,False,nba,t5_2qo4s,3259284,public,self,,,Euroleague vs NBA ( kind of serious ),0,[],0.67,https://www.reddit.com/r/nba/comments/gkejsw/euroleague_vs_nba_kind_of_serious/,all_ads,6,d4562068-3feb-11e8-96a5-0e200b0ff79e,dark,,,,,,,,,,,,,,
14,[],False,[deleted],,,,,,,,[],False,False,1589567073,self.nba,https://www.reddit.com/r/nba/comments/gkejiq/aight_rnba_im_bored_so_i_have_a_question_for_all/,{},gkejiq,False,False,False,False,False,True,False,,[],dark,text,False,,,False,True,1,0,False,all_ads,/r/nba/comments/gkejiq/aight_rnba_im_bored_so_i_have_a_question_for_all/,False,,,6,1589570182,1,,,,True,False,False,nba,t5_2qo4s,3259284,public,default,,,"Aight r/NBA I’m bored so I have a question for all of you. Who do you think is the ultimate journeyman? Consider amount of teams, stats, championships, and overall impact. I gotta go with Robert Horry while he was a only on 4 teams, he’s a 7x champ, he won with 3 teams, and he made so big shots.",0,[],1.0,https://www.reddit.com/r/nba/comments/gkejiq/aight_rnba_im_bored_so_i_have_a_question_for_all/,all_ads,6,,dark,,,,,deleted,moderators,,,,,,,,
15,[],False,JerebkosBiggestFan,Celtics2,[],Celtics,text,t2_yxwzb,False,False,[],False,False,1589567023,self.nba,https://www.reddit.com/r/nba/comments/gkeiz9/best_games_this_year/,{},gkeiz9,True,False,False,False,True,True,False,,[],dark,text,False,,,False,False,24,0,False,all_ads,/r/nba/comments/gkeiz9/best_games_this_year/,False,,,6,1589570136,2,,,"Hi everyone, what are your favorite games so far this year? Bored in quarantine and miss basketball - give me fun ones to rewatch on League Pass. Any team is welcome",True,False,False,nba,t5_2qo4s,3259283,public,self,,,Best games this year?,0,[],1.0,https://www.reddit.com/r/nba/comments/gkeiz9/best_games_this_year/,all_ads,6,,dark,,,,,,,,,,,,,,
16,[],False,3250feralhogs,,[],,text,t2_4d08wccv,False,False,[],False,False,1589566921,self.nba,https://www.reddit.com/r/nba/comments/gkehs7/whos_the_worst_player_to_win_a_championship/,{},gkehs7,True,False,False,False,True,True,False,,[],dark,text,False,,,False,True,40,0,False,all_ads,/r/nba/comments/gkehs7/whos_the_worst_player_to_win_a_championship/,False,,,6,1589570043,1,,,"We hear a lot about the best players to not win one, Ewing and Barkley come to mind, but who was a scrub that got lucky?",True,False,False,nba,t5_2qo4s,3259282,public,self,,,Who's the worst player to win a championship?,0,[],0.67,https://www.reddit.com/r/nba/comments/gkehs7/whos_the_worst_player_to_win_a_championship/,all_ads,6,,,,,,,,,,,,,,,,
17,[],False,[deleted],,,,,,,,[],False,False,1589566909,self.nba,https://www.reddit.com/r/nba/comments/gkehn5/so_rnba_were_all_bored_out_here_because_of/,{},gkehn5,False,False,False,False,False,True,False,,[],dark,text,False,,,False,True,1,0,False,all_ads,/r/nba/comments/gkehn5/so_rnba_were_all_bored_out_here_because_of/,False,,,6,1589570032,1,,,,True,False,False,nba,t5_2qo4s,3259282,public,default,,,"So r/NBA we’re all bored out here because of quarantine so I got a question for you all. Who’s your ultimate journeyman. Consider amount of teams, stats, championships, and how much they helped out. Imo it’s Robert Horry, 7 time champion with 3 different teams. And well he made so big shots,",0,[],1.0,https://www.reddit.com/r/nba/comments/gkehn5/so_rnba_were_all_bored_out_here_because_of/,all_ads,6,,dark,,,,,deleted,moderators,,,,,,,,
